### ISSUE TITLE
LDAP search fails with TLS (Cannot install the TLS handler)

### ISSUE THREAD

**Issue by AngusMcGyver** [BelledonneCommunications/linphone-desktop#927]
### Context

I'm trying to setup LDAP contact search with TLS on linphone-desktop, but the connection can't be established with `Cannot install the TLS handler` error.

LDAP search works without TLS, so credentials are correct.

`ldapsearch` from bash works fine as every other application on my system.

The LDAP server has a certificate signed by a custom CA. I have tried to copy root and intermediate certificate files, as separate files and as a bundle, in these locations:  `/home/user/.local/share/linphone/usr-crt/`, `/etc/openldap/certs/`, `/etc/ssl/certs/`, `/usr/share/ca-certificates/` and `/usr/local/share/ca-certificates/`.

Wireshark analysis (see logs below) of traffic indicates CA is unknown to linphone. Disable certificate verification doesn't help.

**Where to put the CA files, how to name them and which format to use?** Couldn't find any documentation on this.

### General information

OS: Linux - Ubuntu 24.04
Version of the App: [appimage 5.2.6](https://download.linphone.org/releases/linux/app/Linphone-5.2.6.AppImage)

### Expected behaviour

Working LDAP search.

### To Reproduce

    * Configure LDAP search
    * Try to search a contact
    * LDAP search fails ( "Cannot install the TLS handler )

### Additional context, config files

**$HOME/.config/linphone/linphonerc**
```
[misc]
user_certificates_path=/home/user/.local/share/linphone/usr-crt/
…
[ldap_0]
auth_method=1
base_object=dc=global
bind_dn=uid=testuser,ou=users,dc=system,dc=global
debug=1
delay=500
display_name=LDAP intern
enable=1
filter=(cn~=%s)
max_results=50
min_chars=0
name_attribute=cn,sn,givenName
password=*************
server=ldap://ldap.localdomain
sip_attribute=telephoneNumber,mobile
sip_domain=ldap
timeout=5
timeout_tls_ms=1000
use_sal=0
use_tls=1
verify_server_certificates=-1
```

**/etc/ldap/ldap.conf**
```
URI ldap://ldap.localdomain
BASE dc=global
DEREF always
SIZELIMIT 10
TIMELIMIT 10
TLS_REQCERT demand
TLS_CACERT /etc/openldap/certs/ca-bundle.crt
```

### Logs

**Wireshark network traffic**
```
272	13.576303430	10.10.10.10	10.10.10.2	TCP	    74	    54358 → 389 [SYN] Seq=0 Win=64240 Len=0 MSS=1460 SACK_PERM TSval=3427078722 TSecr=0 WS=128
273	13.577011184	10.10.10.2	10.10.10.10	TCP	    74	    389 → 54358 [SYN, ACK] Seq=0 Ack=1 Win=65160 Len=0 MSS=1460 SACK_PERM TSval=3892499542 TSecr=3427078722 WS=128
274	13.577051868	10.10.10.10	10.10.10.2	TCP	    66	    54358 → 389 [ACK] Seq=1 Ack=1 Win=64256 Len=0 TSval=3427078723 TSecr=3892499542
275	13.630680242	10.10.10.10	10.10.10.2	LDAP	97	    extendedReq(1) LDAP_START_TLS_OID 
276	13.631148559	10.10.10.2	10.10.10.10	TCP	    66	    389 → 54358 [ACK] Seq=1 Ack=32 Win=65152 Len=0 TSval=3892499596 TSecr=3427078776
277	13.631891835	10.10.10.2	10.10.10.10	LDAP	80	    extendedResp(1) 
278	13.631944081	10.10.10.10	10.10.10.2	TCP	    66	    54358 → 389 [ACK] Seq=32 Ack=15 Win=64256 Len=0 TSval=3427078778 TSecr=3892499597
279	13.671070333	10.10.10.10	10.10.10.2	TLSv1.2	404	    Client Hello (SNI=ldap.localdomain)
280	13.697506400	10.10.10.2	10.10.10.10	TLSv1.2	162	    Server Hello
281	13.697608883	10.10.10.2	10.10.10.10	TLSv1.2	2420	Certificate
282	13.697608967	10.10.10.2	10.10.10.10	TLSv1.2	627	    Server Key Exchange
283	13.697609013	10.10.10.2	10.10.10.10	TLSv1.2	75	    Server Hello Done
284	13.697629273	10.10.10.10	10.10.10.2	TCP	    66	    54358 → 389 [ACK] Seq=370 Ack=2465 Win=68864 Len=0 TSval=3427078843 TSecr=3892499662
285	13.697711853	10.10.10.10	10.10.10.2	TLSv1.2	73	    Alert (Level: Fatal, Description: Unknown CA)
            Transport Layer Security
                TLSv1.2 Record Layer: Alert (Level: Fatal, Description: Unknown CA)
                    Content Type: Alert (21)
                    Version: TLS 1.2 (0x0303)
                    Length: 2
                    Alert Message
                        Level: Fatal (2)
                        Description: Unknown CA (48)
286	13.697848183	10.10.10.10	10.10.10.2	TLSv1.2	73	    Ignored Unknown Record
287	13.697862885	10.10.10.10	10.10.10.2	TCP	    66	    54358 → 389 [FIN, ACK] Seq=384 Ack=3035 Win=69888 Len=0 TSval=3427078844 TSecr=3892499662
```
**Linphone Log with LDAP Debug enabled**
```
2025-08-08 10:51:50:851 [AppRun.wrapped/liblinphone] MESSAGE [Magic Search] Cancelling : test
2025-08-08 10:51:50:956 [AppRun.wrapped/liblinphone] MESSAGE [Magic Search] Found 0 results in friends
2025-08-08 10:51:50:964 [AppRun.wrapped/liblinphone] MESSAGE [Magic Search] Found 0 results in call logs
2025-08-08 10:51:50:964 [AppRun.wrapped/liblinphone] MESSAGE [Magic Search] Found 0 results in chat rooms
2025-08-08 10:51:50:964 [AppRun.wrapped/liblinphone] MESSAGE Start measurement of [Get conference infos.].
2025-08-08 10:51:50:965 [AppRun.wrapped/liblinphone] MESSAGE Duration of [Get conference infos.]: 0ms.
2025-08-08 10:51:50:965 [AppRun.wrapped/liblinphone] MESSAGE [Magic Search] Found 0 results in conferences info
2025-08-08 10:51:51:169 [AppRun.wrapped/liblinphone] ERROR [LDAP] Cannot install the TLS handler (Connect error), resultStatus -11 (Connect error)
2025-08-08 10:51:51:170 [AppRun.wrapped/liblinphone] MESSAGE [Magic Search] Found 0 results in LDAP.
2025-08-08 10:51:51:251 [AppRun.wrapped/liblinphone] MESSAGE [Magic Search] Found 0 results after sorting, aggregation & removing duplicates
```

**LDAP server log**
```
2025-08-08 10:51:51 conn=4079747 fd=155 ACCEPT from IP=10.10.10.10:34702 (IP=0.0.0.0:389)
2025-08-08 10:51:51 conn=4079747 op=0 EXT oid=1.3.6.1.4.1.1466.20037
2025-08-08 10:51:51 conn=4079747 op=0 STARTTLS
2025-08-08 10:51:51 conn=4079747 op=0 RESULT oid= err=0 qtime=0.000050 etime=0.000586 text=
2025-08-08 10:51:51 TLS: can't accept: A TLS fatal alert has been received..
2025-08-08 10:51:51 conn=4079747 fd=155 closed (TLS negotiation failure)
```
