### ISSUE TITLE
Contact header getting modified when NAT settings disabled

### ISSUE THREAD

**Issue by pvint** [BelledonneCommunications/linphone-desktop#171]
With Enable ICE disabled, Linphone (4.1.1 Linux) is modifying the Contact header to use the public IP which is causing problems. 

Example (SIP server is shown as 1.2.3.4 and public IP on client side is shown as 99.99.99.99):
In the first REGISTER packet the Contact field is correct:
```
 Internet Protocol Version 4, Src: 192.168.86.133, Dst: 1.2.3.4
Transmission Control Protocol, Src Port: 56926, Dst Port: 8061, Seq: 596, Ack: 1999, Len: 661
Secure Sockets Layer
Session Initiation Protocol (EGISTER)
    Request-Line: EGISTER sip:my.realm:8061 SIP/2.0
    Message Header
        Via: SIP/2.0/TLS 192.168.86.133:56926;alias;branch=z9hG4bK.L8jsFGwYX;rport
        From: <sip:211@my.realm>;tag=fUQ~7kkE3
        To: sip:211@my.realm
        CSeq: 20 REGISTER
        Call-ID: J059Dgjwxs
        Max-Forwards: 70
        Supported: replaces, outbound
        Accept: application/sdp
        Accept: text/plain
        Accept: application/vnd.gsma.rcs-ft-http+xml
        Contact: <sip:211@192.168.86.133:56926;transport=tls>;+sip.instance="<urn:uuid:e2bd00d9-3d43-438e-9dc0-99a1c8b9ef9d>"
        Expires: 3600
        User-Agent: Linphone Desktop/4.1.1 (belle-sip/1.6.3)
        Content-Length: 0
```

After the 401 unauthorized message from the server, Linphone sends another INVITE, but this time it is changing the Contact header:
```
Internet Protocol Version 4, Src: 192.168.86.133, Dst: 1.2.3.4
Transmission Control Protocol, Src Port: 56926, Dst Port: 8061, Seq: 1294, Ack: 2532, Len: 901
Secure Sockets Layer
Session Initiation Protocol (EGISTER)
    Request-Line: EGISTER sip:my.realm:8061 SIP/2.0
    Message Header
        Via: SIP/2.0/TLS 192.168.86.133:56926;alias;branch=z9hG4bK.BqlIGghXQ;rport
        From: <sip:211@my.realm>;tag=fUQ~7kkE3
        To: sip:211@my.realm
        CSeq: 21 REGISTER
        Call-ID: J059Dgjwxs
        Max-Forwards: 70
        Supported: replaces, outbound
        Accept: application/sdp
        Accept: text/plain
        Accept: application/vnd.gsma.rcs-ft-http+xml
        Contact: <sip:211@99.99.99.99:56926;transport=tls>;+sip.instance="<urn:uuid:e2bd00d9-3d43-438e-9dc0-99a1c8b9ef9d>"
        Expires: 3600
        User-Agent: Linphone Desktop/4.1.1 (belle-sip/1.6.3)
```

For reference, I did a capture with a Polycom phone which works fine, and here is the Contact header it uses:
```
        Contact: <sip:250@192.168.86.126:48905;transport=tls>;methods="INVITE, ACK, BYE, CANCEL, OPTIONS, INFO, MESSAGE, SUBSCRIBE, NOTIFY, PRACK, UPDATE, REFER"
        User-Agent: PolycomVVX-VVX_410-UA/5.6.0.17325
```

I have tried manually making some changes in linphonerc without success:
```
use_nat=0
use_stun=0
```

How can we prevent Linphone's modification of the Contact header?
